{
  "auto_install": true,
  "rules": {
    "type": {
      "required": true,
      "allowed": ["feat", "fix", "docs", "test", "refactor", "chore"]
    },
    "scope": {
      "required": true,
      "allowed": ["auth", "api", "ui", "db", "config", "test", "docs"]
    },
    "subject": {
      "min_length": 10,
      "max_length": 50,
      "case": "lower",
      "end_with_period": false
    },
    "body": {
      "max_line_length": 72,
      "leading_blank": true
    },
    "footer": {
      "leading_blank": true
    }
  },
  "patterns": {
    "breaking_change": "/^BREAKING CHANGE:/",
    "issue_reference": "/(?:close[sd]?|fix(?:e[sd])?|resolve[sd]?)\\s+#\\d+/i",
    "ticket_reference": "/JIRA-\\d+/"
  },
  "hooks": {
    "commit-msg": true,
    "pre-commit": true,
    "pre-push": false
  }
}
